character	value	profanities	line	profanityList
Chief Stevens	7	0	Come on, Manson. You belong in jail.	[]
Manson	6	0	You're darn right I do.	[]
Howard	16	0	Well, I guess I'll be going, Mom and Dad. I hope you can forgive me.	[]
Grandma	18	0	Oh, of course we forgive you, son. It was nice of you to pop in for the holidays.	[]
Grandpa	8	1	Yes. Now, watch that ass in prison, son.	['ass']
Howard	11	0	I always do. See ya, Eric. Thanks for all your help.	[]
Cartman	17	1	See ya, Uncle Howard.  Thanks for being such a great role model for me.  Piece of crap.	['crap']
Stan	8	0	I hope you can forgive me, too, Mom.	[]
Sharon	16	0	Oh, Stanley. Let's just forget the whole thing and have a nice holiday back home.	[]
Stan	1	0	Really?	[]
Randy	8	0	Sure. We'll punish you after the holidays.	[]
Stan	6	0	Hooray! Uh, I mean, wait. What?	[]
Robert Pooner	32	0	And so, Manson is hauled off to jail to rot in his cell. Everything is back to normal, and I guess the only thing left to say is, God bless us, everyone.	[]
Manson	96	0	And I guess that's what I've learned. I'm sorry for what I did, but that doesn't make up for it. I deserve to be in jail. All I hope is that I don't make mankind lose faith in itself. Yes, there's murderers in the world. There's rapists and thieves. But those are the vast minority. The majority of mankind is made up of caring people, who try every day to do what they think is right. And that's the spirit of the season. What do you think, guys?	[]
Inmate	8	0	It sucks, just like all your other books.	[]
Manson	8	0	Well, Guh Good night, you guys. Happy Holidays.	[]
Inmate	2	0	Shut up!	[]
Manson	5	0	What was that?  What the?!	[]
Cartmans/Boys	40	0	Merry Christmas, Charlie Manson!  Hark, the herald angels sin, Glory to the newborn King Peace on earth, and mercy mild God and sinners reconciled Joyful all ye nations rise Join the triumph of the skies Hark, the herald angels sing	[]
Stan	8	1	Dude, this is pretty fucked up right here.	['fucked']
