character	value	profanities	line	profanityList
Dr. Lott	8	0	Oh, hello, piggy. How are your eyes doing?	[]
Cartman	17	0	After today they're gonna be fine, and I'll never have to see you ever again!	[]
Dr. Lott	12	0	I don't think that's possible, piggy, not with your eyes.	[]
Cartman	13	0	No, not with my eyes. With these!  Ha ha ha ha ha ha!	[]
Dr. Lott	5	0	Was he an organ donor?	[]
Cartman	2	0	Eh-sure.	[]
Dr. Lott	22	0	All right, then let's get to work.  Say, you don't have three dollars and fifty cents on you, do you?	[]
